{
  "$schema": "https://json-schema.org/draft/2020-12/schema",
  "$id": "https://wstein.github.io/sourcesteward/schemas/v1/release-build-manifest.schema.json",
  "title": "SourceSteward release build manifest (schema 1)",
  "type": "object",
  "additionalProperties": false,
  "required": ["schema_version", "kind", "project", "version", "commit", "source_date_epoch", "config_sha256", "stw_version", "repository", "run", "builds", "assets"],
  "properties": {
    "schema_version": {"const": 1},
    "kind": {"const": "build-manifest"},
    "project": {"type": "string", "pattern": "^[A-Za-z0-9._ -]{1,64}$"},
    "product": {"type": "string", "pattern": "^[a-z0-9][a-z0-9-]{0,31}$"},
    "version": {"type": "string", "pattern": "^[A-Za-z0-9._-]{1,64}$"},
    "commit": {"type": "string", "pattern": "^([0-9a-f]{40}|[0-9a-f]{64})$"},
    "source_date_epoch": {"type": ["integer", "null"], "minimum": 0},
    "config_sha256": {"type": "string", "pattern": "^[0-9a-f]{64}$"},
    "stw_version": {"type": "string", "pattern": "^[A-Za-z0-9._+-]{1,64}$"},
    "repository": {"type": "string", "pattern": "^[A-Za-z0-9._-]{1,100}/[A-Za-z0-9._-]{1,100}$"},
    "run": {
      "type": "object", "additionalProperties": false, "required": ["workflow", "run_id", "run_attempt"],
      "properties": {
        "workflow": {"type": "string", "pattern": "^[A-Za-z0-9._][A-Za-z0-9._/-]{0,255}$"},
        "run_id": {"type": "integer", "minimum": 0},
        "run_attempt": {"type": "integer", "minimum": 1}
      }
    },
    "builds": {
      "type": "array", "maxItems": 16,
      "items": {
        "type": "object", "additionalProperties": false, "required": ["id", "network", "network_hosts", "lock_files"],
        "properties": {
          "id": {"type": "string", "pattern": "^[a-z0-9][a-z0-9-]{0,31}$"},
          "network": {"enum": ["none", "fetch"]},
          "network_hosts": {"type": "array", "maxItems": 64, "items": {"type": "string", "pattern": "^[a-z0-9][a-z0-9.-]{0,252}$"}},
          "lock_files": {
            "type": "array", "maxItems": 16,
            "items": {
              "type": "object", "additionalProperties": false, "required": ["path", "sha256"],
              "properties": {"path": {"type": "string", "pattern": "^[A-Za-z0-9._][A-Za-z0-9._/-]{0,255}$"}, "sha256": {"type": "string", "pattern": "^[0-9a-f]{64}$"}}
            }
          }
        }
      }
    },
    "assets": {"type": "array", "minItems": 1, "maxItems": 64, "items": {"$ref": "https://wstein.github.io/sourcesteward/schemas/v1/release-record.schema.json#/$defs/asset"}}
  }
}
