{
  "assets": [
    {
      "arch": "arm64",
      "build": "cli",
      "group": "cli",
      "kind": "file",
      "name": "stw_0.2.0_darwin_arm64.tar.gz",
      "os": "darwin",
      "role": "artifact",
      "sha256": "15c67c8231ff592fc8de54fc19c8d661f502189d6b003c748851edfd93a4b0d9",
      "size": 1000000,
      "target": "darwin-arm64",
      "url_template": "https://github.com/{repository}/releases/download/{tag}/{name}"
    },
    {
      "arch": "amd64",
      "build": "cli",
      "group": "cli",
      "kind": "file",
      "name": "stw_0.2.0_linux_amd64.tar.gz",
      "os": "linux",
      "role": "artifact",
      "sha256": "898f6071345796e3364588c704b5113ae18aa09f5ba29b276307c3ea0ea2de67",
      "size": 1000000,
      "target": "linux-amd64",
      "url_template": "https://github.com/{repository}/releases/download/{tag}/{name}"
    },
    {
      "arch": "arm64",
      "build": "cli",
      "group": "cli",
      "kind": "file",
      "name": "stw_0.2.0_linux_arm64.tar.gz",
      "os": "linux",
      "role": "artifact",
      "sha256": "4fdde1ad9bf9ce47c4f04bc2fc157180632b1cad2e96f46cb919fbfbe7b38017",
      "size": 1000000,
      "target": "linux-arm64",
      "url_template": "https://github.com/{repository}/releases/download/{tag}/{name}"
    }
  ],
  "builds": [
    {
      "id": "cli",
      "lock_files": [],
      "network": "none",
      "network_hosts": []
    }
  ],
  "commit": "4e7f3b62e29abc3b6014b68eb9b7ddfce9c9b702",
  "config_sha256": "e67d23e7820c49a8051dac2831f38290f5e72f66c8db5079eeb60d82f14894c0",
  "kind": "build-manifest",
  "project": "SourceSteward",
  "repository": "wstein/sourcesteward",
  "run": {
    "run_attempt": 1,
    "run_id": 12345678901,
    "workflow": ".github/workflows/release-build.yml"
  },
  "schema_version": 1,
  "source_date_epoch": 1760000000,
  "stw_version": "v0.1.0",
  "version": "v0.2.0"
}
