{
  "assets": [
    {
      "arch": "any",
      "build": "fetch",
      "group": "sources",
      "kind": "file",
      "name": "zlib-1.3.1-sources.tar.gz",
      "os": "any",
      "role": "artifact",
      "sha256": "87663f4f177de90759cb1fe1cd671495f36b70edfc70c68fa6881b9dc479a148",
      "size": 1000000,
      "target": "sources",
      "url_template": "https://github.com/{repository}/releases/download/{tag}/{name}"
    },
    {
      "arch": "any",
      "build": "fetch",
      "group": "sources",
      "kind": "file",
      "name": "zlib-1.3.1-sources.manifest.json",
      "os": "any",
      "role": "manifest",
      "sha256": "10ba240140a2e2b0c516ec67add5dd4d42cbee50af9b3c0e691936fb3353f860",
      "size": 1000000,
      "target": "sources-manifest",
      "url_template": "https://github.com/{repository}/releases/download/{tag}/{name}"
    }
  ],
  "builds": [
    {
      "id": "fetch",
      "lock_files": [
        {
          "path": "sources/zlib.lock.json",
          "sha256": "0c030586945fe504b604ecc2e875c38ede400cd5cd73da9730302162e6b02c6f"
        }
      ],
      "network": "fetch",
      "network_hosts": [
        "zlib.net",
        "github.com"
      ]
    }
  ],
  "commit": "4e7f3b62e29abc3b6014b68eb9b7ddfce9c9b702",
  "config_sha256": "e67d23e7820c49a8051dac2831f38290f5e72f66c8db5079eeb60d82f14894c0",
  "kind": "build-manifest",
  "product": "zlib",
  "project": "BundleDock third-party sources",
  "repository": "wstein/bundledock-third-party-sources",
  "run": {
    "run_attempt": 1,
    "run_id": 12345678901,
    "workflow": ".github/workflows/release-build.yml"
  },
  "schema_version": 1,
  "source_date_epoch": 1760000000,
  "stw_version": "v0.1.0",
  "version": "1.3.1"
}
